{
    "gid": "aiverify.stock.fairness_metrics_toolbox_for_classification",
    "version": "0.10.0",
    "name": "fairness metrics toolbox for classification",
    "author": "AI Verify",
    "description": "The Fairness Metrics Toolbox (FMT) for Classification contains a list of fairness metrics to measure how resources (e.g. opportunities, food, loan, medical help) are allocated among the demographic groups (e.g. married male, married female) given a set of sensitive feature(s) (e.g. gender, marital status). This plugin is developed for classification models."
}