{
    "gid": "aiverify.stock.veritas",
    "version": "2.0.0a2",
    "name": "AI Verify Veritas",
    "author": "AI Verify",
    "description": "The purpose of this toolkit is to facilitate the adoption of Veritas Methodology on Fairness & Transparency Assessment and spur industry development. It will also benefit customers by improving the fairness and transparency of financial services delivered by AIDA systems."
}
